Line,Location,Length of defect (metres),Distance between stations (metres),Track under reduced speed (%),Reduced speed (km/h),Normal speed (km/h),Reason,Target removal
Line 1 (Yonge-University) to Vaughan Metropolitan Centre Station,Southbound Eglinton to Davisville,152,891,17,25,32,Track issue,Early November
Line 1 (Yonge-University) to Vaughan Metropolitan Centre Station,Northbound Spadina to Dupont,152,559,27,20,32,Track issue,Late October
Line 1 (Yonge-University) to Vaughan Metropolitan Centre Station,Northbound Glencairn to Lawrence West,165,763,22,20,37,Track issue,Late October
Line 1 (Yonge-University) to Finch Station,Southbound Yorkdale to Lawrence West,579,"1,122",52,35,48,Track issue,Late November
Line 1 (Yonge-University) to Finch Station,Southbound Lawrence West to Glencairn,157,750,21,15,39,Track issue,Late October
Line 1 (Yonge-University) to Finch Station,Southbound Eglinton West to St Clair West,159,"2,629",6,20,44,Track issue,Late October
Line 1 (Yonge-University) to Finch Station,Northbound Union to King,183,454,40,15,27,Track issue,Late November
Line 2 (Bloor-Danforth) to Kennedy Station,Eastbound Kipling to Islington,210,"1,282",16,20,31,Track issue,Late November
Line 2 (Bloor-Danforth) to Kipling Station,Westbound Jane to Old Mill,183,889,21,35,37,Track issue,Late October
