Line,Location,Length of defect (metres),Distance between stations (metres),Track under reduced speed (%),Reduced speed (km/h),Normal speed (km/h),Reason,Target removal
Line 1 (Yonge-University) to Vaughan Metropolitan Centre Station,Southbound Eglinton to Davisville,152,891,17,25,44,Track issue,Mid-July
Line 1 (Yonge-University) to Vaughan Metropolitan Centre Station,Northbound Museum to St George,46,643,7,15,32,Track issue,Mid-July
Line 1 (Yonge-University) to Vaughan Metropolitan Centre Station,Northbound Yorkdale to Wilson,152,"1,108",14,40,64,Track issue,TBD
Line 1 (Yonge-University) to Finch Station,Southbound Osgoode to St Andrew,152,386,39,25,51,Switch issue,TBD
Line 2 (Bloor-Danforth) to Kipling Station,Westbound Dundas West to Keele,198,632,31,15,52,Switch issue,TBD
